{
  "id": "synth-20260410-130000",
  "opportunity_id": "opp-20260410-100000",
  "status": "presented",
  "verdict_summary": "proceed — gamified savings has strong potential but needs phased rollout with 3 distinct solution tracks",
  "convergence": [
    {
      "finding": "Deal Hunter segment is large (28% MAU) and under-converted to Pro (8% of Pro base)",
      "sources": ["contrib-analyst-20260410-101500:find-001", "contrib-data-20260410-101500:find-001"],
      "agent_count": 2
    },
    {
      "finding": "Current trial-to-paid conversion (37%) has clear improvement headroom with better value demonstration",
      "sources": ["contrib-data-20260410-101500:find-001", "contrib-design-20260410-101500:find-001"],
      "agent_count": 2
    }
  ],
  "counter_signals": [
    {
      "finding_ref": "contrib-analyst-20260410-101500:find-002",
      "summary": "Competitor gamification shows declining engagement after 60 days — novelty wears off without deeper value",
      "severity": "notable",
      "addressed": false
    }
  ],
  "conflicts": [
    {
      "topic": "Gamification longevity",
      "side_a": {
        "position": "Savings streaks create lasting habits when tied to real financial benefit",
        "agents": ["design"],
        "evidence": "Prototype testing showed high engagement with visible savings accumulation"
      },
      "side_b": {
        "position": "Gamification features decay in engagement after 60 days across all regional competitors",
        "agents": ["analyst"],
        "evidence": "Competitive analysis of Careem Plus and Noon VIP programs"
      },
      "resolution": "Phase 1 focuses on financial transparency (real savings), not gamification mechanics — test whether value visibility alone drives retention before adding game layers"
    }
  ],
  "evidence_summary": {
    "total_findings": 7,
    "by_function": {
      "analyst": 3,
      "data": 1,
      "design": 2,
      "engineering": 1
    },
    "strongest_signal": {
      "finding_ref": "contrib-analyst-20260410-101500:find-001",
      "summary": "Deal Hunter segment (28% MAU) is heavily under-converted to Pro (8%)"
    },
    "strongest_counter_signal": {
      "finding_ref": "contrib-analyst-20260410-101500:find-002",
      "summary": "Competitor gamification features show declining engagement after 60 days"
    }
  },
  "artifacts": [
    {
      "path": "artifacts/market.md",
      "type": "analysis",
      "description": "Market sizing and competitive landscape for gamified loyalty",
      "produced_by": "analyst"
    },
    {
      "path": "artifacts/data.md",
      "type": "analysis",
      "description": "Pro conversion funnel analysis",
      "produced_by": "data"
    },
    {
      "path": "artifacts/savings-streak-prototype-v1.html",
      "type": "prototype",
      "description": "Interactive savings streak prototype",
      "produced_by": "design"
    }
  ],
  "recommendation": "proceed",
  "rationale": "The Deal Hunter segment represents a large, under-converted audience for Pro. Current trial-to-paid conversion (37%) has clear headroom. While gamification longevity is a risk (competitor data shows 60-day decay), phasing the approach — starting with savings transparency before adding game mechanics — mitigates this. Three solution tracks identified with clear sequencing.",
  "expected_impact": "8,400+ additional Pro subscribers per quarter in UAE, with potential 2x across GCC markets.",
  "estimated_effort": "Phase 1: 3-4 sprints. Phase 2: 4-6 sprints. Phase 3: 6-8 sprints.",
  "solutions": [
    {
      "id": "sol-001",
      "title": "Pro Savings Dashboard — real-time visibility into Pro savings",
      "description": "Add a savings dashboard to the Pro subscription screen showing cumulative savings from free delivery, cashback, and exclusive deals. No gamification — pure financial transparency.",
      "evidence_refs": ["contrib-data-20260410-101500:find-001", "contrib-design-20260410-101500:find-001"],
      "recommendation": "proceed",
      "rationale": "Low effort, high signal. Tests whether value visibility alone improves trial-to-paid conversion before investing in gamification.",
      "expected_impact": "5-8% improvement in trial-to-paid conversion",
      "estimated_effort": "3-4 sprints",
      "ice_score": {
        "impact": 7,
        "confidence": 8,
        "ease": 9,
        "total": 504
      },
      "archetype": "incremental",
      "status": "proposed"
    },
    {
      "id": "sol-002",
      "title": "30-Day Savings Streak — gamified daily savings challenge",
      "description": "Introduce a 30-day savings streak mechanic where users earn bonus cashback for consecutive days of Pro usage. Includes streak recovery and milestone rewards.",
      "evidence_refs": ["contrib-design-20260410-101500:find-001", "contrib-analyst-20260410-101500:find-002"],
      "recommendation": "proceed_if",
      "rationale": "High potential but depends on sol-001 results. Only proceed if savings dashboard shows >3% conversion lift, confirming value visibility drives behavior.",
      "expected_impact": "10-15% improvement in 90-day retention for engaged users",
      "estimated_effort": "4-6 sprints",
      "ice_score": {
        "impact": 9,
        "confidence": 5,
        "ease": 6,
        "total": 270
      },
      "archetype": "moderate",
      "depends_on": ["sol-001"],
      "proceed_conditions": [
        {
          "condition": "Savings dashboard shows conversion lift",
          "measurement": "Trial-to-paid conversion rate delta",
          "threshold": ">3% improvement vs control"
        }
      ],
      "status": "proposed"
    },
    {
      "id": "sol-003",
      "title": "Social Savings Leaderboard — competitive savings ranking among friends",
      "description": "Add a social layer where Pro subscribers can see how their savings compare to friends. Requires social graph integration and privacy controls.",
      "evidence_refs": ["contrib-analyst-20260410-101500:find-003"],
      "recommendation": "defer",
      "rationale": "Highest potential impact but requires social graph infrastructure that doesn't exist. Defer until sol-001 and sol-002 validate the savings-as-motivation hypothesis.",
      "expected_impact": "Potential 20%+ Pro adoption increase if savings motivation is validated",
      "estimated_effort": "6-8 sprints",
      "ice_score": {
        "impact": 10,
        "confidence": 3,
        "ease": 3,
        "total": 90
      },
      "archetype": "ambitious",
      "depends_on": ["sol-001", "sol-002"],
      "status": "proposed"
    }
  ],
  "recommended_sequence": ["sol-001", "sol-002", "sol-003"],
  "quality_score": {
    "assumption_coverage": 0.85,
    "evidence_balance": 0.8,
    "conflict_surfacing": 0.9,
    "artifact_relevance": 0.85,
    "overall": 0.85
  },
  "created_at": "2026-04-10T13:00:00Z"
}
